{
  "$schema": "https://json-schema.org/draft/2020-12/schema",
  "$id": "qa-to-documentation.schema.json",
  "title": "QA to Documentation Handoff Artifact",
  "description": "Structured artifact produced by the QA Orchestrator and consumed by the Documentation Orchestrator. Contains the verified codebase reference, full test results, known limitations, security sign-off, and performance summary.",
  "type": "object",
  "required": [
    "schemaVersion",
    "projectName",
    "verifiedCodebaseReference",
    "testResults",
    "knownLimitationsLog",
    "securitySignOff",
    "performanceSummary"
  ],
  "properties": {
    "schemaVersion": {
      "type": "string",
      "description": "Version of this schema used to produce the artifact."
    },
    "projectName": {
      "type": "string",
      "description": "Human-readable name of the target project as configured in This Project."
    },
    "verifiedCodebaseReference": {
      "type": "object",
      "description": "Reference to the exact codebase revision verified by QA.",
      "required": ["commitHash", "branch", "verifiedAt"],
      "properties": {
        "commitHash": {
          "type": "string",
          "description": "Full Git commit hash of the verified codebase state."
        },
        "branch": {
          "type": "string",
          "description": "Git branch on which verification was performed."
        },
        "verifiedAt": {
          "type": "string",
          "description": "ISO 8601 UTC timestamp when QA verification was completed.",
          "format": "date-time"
        }
      },
      "additionalProperties": false
    },
    "testResults": {
      "type": "object",
      "description": "Summary of all test outcomes across the QA phase.",
      "required": ["unitTestsPassed", "integrationTestsPassed", "e2eTestsPassed", "totalDefectsFound", "totalDefectsResolved"],
      "properties": {
        "unitTestsPassed": {
          "type": "boolean",
          "description": "True if all unit tests pass with no failures or errors."
        },
        "integrationTestsPassed": {
          "type": "boolean",
          "description": "True if all integration tests pass with no failures or errors."
        },
        "e2eTestsPassed": {
          "type": "boolean",
          "description": "True if all end-to-end tests pass with no failures or errors."
        },
        "totalDefectsFound": {
          "type": "integer",
          "description": "Total number of defects raised during the QA phase.",
          "minimum": 0
        },
        "totalDefectsResolved": {
          "type": "integer",
          "description": "Total number of defects resolved and re-verified. Must equal totalDefectsFound for gate to pass.",
          "minimum": 0
        }
      },
      "additionalProperties": false
    },
    "knownLimitationsLog": {
      "type": "array",
      "description": "Documented limitations and edge cases discovered during QA that are accepted and will be noted in documentation. Empty if none.",
      "items": {
        "type": "object",
        "required": ["limitation", "impact", "workaround"],
        "properties": {
          "limitation": {
            "type": "string",
            "description": "Description of the limitation."
          },
          "impact": {
            "type": "string",
            "description": "Who is affected by this limitation and under what conditions."
          },
          "workaround": {
            "type": "string",
            "description": "Known workaround, or 'none' if no workaround exists."
          }
        },
        "additionalProperties": false
      }
    },
    "securitySignOff": {
      "type": "object",
      "description": "Security reviewer sign-off confirming the codebase has been assessed against the OWASP Top 10.",
      "required": ["reviewedBy", "owaspFindingsStatus", "openFindings", "signOffGranted"],
      "properties": {
        "reviewedBy": {
          "type": "string",
          "description": "Name of the agent that performed the security review (always 'security-reviewer')."
        },
        "owaspFindingsStatus": {
          "type": "string",
          "description": "Summary status of the OWASP Top 10 assessment.",
          "enum": ["all-mitigated", "open-low-only", "open-medium", "open-high", "open-critical"]
        },
        "openFindings": {
          "type": "array",
          "description": "Any OWASP findings that remain open. Empty if all mitigated.",
          "items": {
            "type": "object",
            "required": ["owaspItem", "description", "severity"],
            "properties": {
              "owaspItem": { "type": "string", "description": "OWASP Top 10 category." },
              "description": { "type": "string", "description": "Specific finding description." },
              "severity": {
                "type": "string",
                "enum": ["critical", "high", "medium", "low"],
                "description": "Severity of this finding."
              }
            },
            "additionalProperties": false
          }
        },
        "signOffGranted": {
          "type": "boolean",
          "description": "True only when no critical or high OWASP findings remain open."
        }
      },
      "additionalProperties": false
    },
    "performanceSummary": {
      "type": "object",
      "description": "Performance characteristics observed during QA testing.",
      "required": ["metricsRecorded", "bottlenecksIdentified", "meetsNonFunctionalRequirements"],
      "properties": {
        "metricsRecorded": {
          "type": "array",
          "description": "Performance metrics observed during testing.",
          "items": {
            "type": "object",
            "required": ["metric", "value", "unit"],
            "properties": {
              "metric": { "type": "string", "description": "Name of the metric (e.g., 'p99 response time')." },
              "value": { "type": "number", "description": "Measured value." },
              "unit": { "type": "string", "description": "Unit of measurement (e.g., 'ms', 'rps')." }
            },
            "additionalProperties": false
          }
        },
        "bottlenecksIdentified": {
          "type": "array",
          "description": "Performance bottlenecks identified and their impact. Empty if none.",
          "items": { "type": "string" }
        },
        "meetsNonFunctionalRequirements": {
          "type": "boolean",
          "description": "True if all performance non-functional requirements from the discovery artifact are satisfied."
        }
      },
      "additionalProperties": false
    },
    "ticketKey": {
      "type": "string",
      "description": "Optional validated TICKET_KEY scoping this run to knowledge-base/plans/active/<TICKET_KEY>/. Must match the pattern ^[A-Z][A-Z0-9]+-[1-9][0-9]*$. Absent for offline runs.",
      "pattern": "^[A-Z][A-Z0-9]+-[1-9][0-9]*$"
    },
    "sessionPath": {
      "type": "string",
      "description": "Optional active artifact directory derived from ticketKey. Defaults to knowledge-base/plans/active/ when absent."
    }
  },
  "additionalProperties": false
}
